<?xml version="1.0" encoding="UTF-8"?>
<!DOCTYPE main SYSTEM "armPosition.dtd">
<main>
  <arm>
    <angle>90</angle>
  </arm>
  <arm>
    <angle>90</angle>
  </arm>
  <arm>
    <angle>90</angle>
  </arm>
  <x>100</x>
  <y>150</y>
  <active_joints>3</active_joints>
</main>
